[
  {
    "id": "V-001",
    "name": "Pickup NB-001",
    "status": "active",
    "lat": 53.52787,
    "lng": -2.21605,
    "lastUpdate": "2026-10-23T03:48:17.000Z"
  },
  {
    "id": "V-002",
    "name": "Pickup NB-002",
    "status": "active",
    "lat": 53.49371,
    "lng": -2.17691,
    "lastUpdate": "2026-10-22T20:39:52.000Z"
  },
  {
    "id": "V-003",
    "name": "Van NB-003",
    "status": "offline",
    "lat": 53.51186,
    "lng": -2.2886,
    "lastUpdate": "2026-10-23T03:15:58.000Z"
  },
  {
    "id": "V-004",
    "name": "Pickup NB-004",
    "status": "idle",
    "lat": 53.49159,
    "lng": -2.34923,
    "lastUpdate": "2026-10-22T20:42:05.000Z"
  },
  {
    "id": "V-005",
    "name": "Lorry NB-005",
    "status": "active",
    "lat": 53.48885,
    "lng": -2.34369,
    "lastUpdate": "2026-10-23T01:35:36.000Z"
  },
  {
    "id": "V-006",
    "name": "Van NB-006",
    "status": "active",
    "lat": 53.51753,
    "lng": -2.24393,
    "lastUpdate": "2026-10-23T07:20:57.000Z"
  },
  {
    "id": "V-007",
    "name": "Van NB-007",
    "status": "maintenance",
    "lat": 53.47316,
    "lng": -2.1882,
    "lastUpdate": "2026-10-23T00:19:59.000Z"
  },
  {
    "id": "V-008",
    "name": "Truck NB-008",
    "status": "active",
    "lat": 53.40771,
    "lng": -2.23868,
    "lastUpdate": "2026-10-22T17:40:43.000Z"
  },
  {
    "id": "V-009",
    "name": "Van NB-009",
    "status": "idle",
    "lat": 53.43143,
    "lng": -2.28927,
    "lastUpdate": "2026-10-22T14:16:24.000Z"
  },
  {
    "id": "V-010",
    "name": "Lorry NB-010",
    "status": "active",
    "lat": 53.43063,
    "lng": -2.29316,
    "lastUpdate": "2026-10-23T00:58:06.000Z"
  },
  {
    "id": "V-011",
    "name": "Van NB-011",
    "status": "idle",
    "lat": 53.50212,
    "lng": -2.21138,
    "lastUpdate": "2026-10-22T09:43:55.000Z"
  },
  {
    "id": "V-012",
    "name": "Van NB-012",
    "status": "offline",
    "lat": 53.46467,
    "lng": -2.16154,
    "lastUpdate": "2026-10-23T04:42:18.000Z"
  },
  {
    "id": "V-013",
    "name": "Van NB-013",
    "status": "active",
    "lat": 53.45407,
    "lng": -2.25366,
    "lastUpdate": "2026-10-22T17:18:50.000Z"
  },
  {
    "id": "V-014",
    "name": "Lorry NB-014",
    "status": "active",
    "lat": 53.50794,
    "lng": -2.16303,
    "lastUpdate": "2026-10-23T01:19:20.000Z"
  },
  {
    "id": "V-015",
    "name": "Pickup NB-015",
    "status": "active",
    "lat": 53.47805,
    "lng": -2.18562,
    "lastUpdate": "2026-10-23T05:06:21.000Z"
  },
  {
    "id": "V-016",
    "name": "Lorry NB-016",
    "status": "idle",
    "lat": 53.53742,
    "lng": -2.2632,
    "lastUpdate": "2026-10-22T18:07:02.000Z"
  },
  {
    "id": "V-017",
    "name": "Truck NB-017",
    "status": "idle",
    "lat": 53.44844,
    "lng": -2.20412,
    "lastUpdate": "2026-10-23T00:54:54.000Z"
  },
  {
    "id": "V-018",
    "name": "Truck NB-018",
    "status": "maintenance",
    "lat": 53.50426,
    "lng": -2.1512,
    "lastUpdate": "2026-10-22T10:38:07.000Z"
  },
  {
    "id": "V-019",
    "name": "Truck NB-019",
    "status": "active",
    "lat": 53.44439,
    "lng": -2.32982,
    "lastUpdate": "2026-10-22T15:16:44.000Z"
  },
  {
    "id": "V-020",
    "name": "Truck NB-020",
    "status": "maintenance",
    "lat": 53.53572,
    "lng": -2.33127,
    "lastUpdate": "2026-10-22T20:35:27.000Z"
  },
  {
    "id": "V-021",
    "name": "Lorry NB-021",
    "status": "active",
    "lat": 53.54591,
    "lng": -2.31432,
    "lastUpdate": "2026-10-22T14:58:26.000Z"
  },
  {
    "id": "V-022",
    "name": "Pickup NB-022",
    "status": "active",
    "lat": 53.46193,
    "lng": -2.31731,
    "lastUpdate": "2026-10-22T16:17:17.000Z"
  },
  {
    "id": "V-023",
    "name": "Truck NB-023",
    "status": "active",
    "lat": 53.49434,
    "lng": -2.17262,
    "lastUpdate": "2026-10-23T00:10:01.000Z"
  },
  {
    "id": "V-024",
    "name": "Lorry NB-024",
    "status": "active",
    "lat": 53.41971,
    "lng": -2.17726,
    "lastUpdate": "2026-10-22T23:07:38.000Z"
  },
  {
    "id": "V-025",
    "name": "Van NB-025",
    "status": "idle",
    "lat": 53.49529,
    "lng": -2.17482,
    "lastUpdate": "2026-10-22T10:12:15.000Z"
  },
  {
    "id": "V-026",
    "name": "Van NB-026",
    "status": "idle",
    "lat": 53.47339,
    "lng": -2.3132,
    "lastUpdate": "2026-10-23T06:51:39.000Z"
  },
  {
    "id": "V-027",
    "name": "Pickup NB-027",
    "status": "idle",
    "lat": 53.44372,
    "lng": -2.2949,
    "lastUpdate": "2026-10-22T23:55:18.000Z"
  },
  {
    "id": "V-028",
    "name": "Van NB-028",
    "status": "active",
    "lat": 53.54903,
    "lng": -2.23553,
    "lastUpdate": "2026-10-22T08:16:29.000Z"
  },
  {
    "id": "V-029",
    "name": "Van NB-029",
    "status": "active",
    "lat": 53.48414,
    "lng": -2.2915,
    "lastUpdate": "2026-10-22T22:31:42.000Z"
  },
  {
    "id": "V-030",
    "name": "Truck NB-030",
    "status": "active",
    "lat": 53.50292,
    "lng": -2.2703,
    "lastUpdate": "2026-10-22T23:56:00.000Z"
  },
  {
    "id": "V-031",
    "name": "Lorry NB-031",
    "status": "active",
    "lat": 53.47429,
    "lng": -2.22783,
    "lastUpdate": "2026-10-22T18:53:15.000Z"
  },
  {
    "id": "V-032",
    "name": "Pickup NB-032",
    "status": "active",
    "lat": 53.4488,
    "lng": -2.29024,
    "lastUpdate": "2026-10-23T00:18:24.000Z"
  },
  {
    "id": "V-033",
    "name": "Pickup NB-033",
    "status": "active",
    "lat": 53.4254,
    "lng": -2.211,
    "lastUpdate": "2026-10-23T00:27:32.000Z"
  },
  {
    "id": "V-034",
    "name": "Van NB-034",
    "status": "active",
    "lat": 53.40636,
    "lng": -2.23449,
    "lastUpdate": "2026-10-23T03:00:56.000Z"
  },
  {
    "id": "V-035",
    "name": "Truck NB-035",
    "status": "active",
    "lat": 53.50681,
    "lng": -2.16747,
    "lastUpdate": "2026-10-22T12:31:10.000Z"
  },
  {
    "id": "V-036",
    "name": "Truck NB-036",
    "status": "active",
    "lat": 53.53014,
    "lng": -2.24486,
    "lastUpdate": "2026-10-22T11:49:52.000Z"
  },
  {
    "id": "V-037",
    "name": "Lorry NB-037",
    "status": "active",
    "lat": 53.42199,
    "lng": -2.22625,
    "lastUpdate": "2026-10-22T12:37:05.000Z"
  },
  {
    "id": "V-038",
    "name": "Van NB-038",
    "status": "active",
    "lat": 53.48185,
    "lng": -2.1531,
    "lastUpdate": "2026-10-22T20:11:32.000Z"
  },
  {
    "id": "V-039",
    "name": "Lorry NB-039",
    "status": "maintenance",
    "lat": 53.51154,
    "lng": -2.33929,
    "lastUpdate": "2026-10-23T06:20:09.000Z"
  },
  {
    "id": "V-040",
    "name": "Van NB-040",
    "status": "active",
    "lat": 53.5015,
    "lng": -2.19784,
    "lastUpdate": "2026-10-22T08:12:19.000Z"
  },
  {
    "id": "V-041",
    "name": "Lorry NB-041",
    "status": "idle",
    "lat": 53.52555,
    "lng": -2.17941,
    "lastUpdate": "2026-10-22T17:36:53.000Z"
  },
  {
    "id": "V-042",
    "name": "Truck NB-042",
    "status": "active",
    "lat": 53.53176,
    "lng": -2.2138,
    "lastUpdate": "2026-10-22T23:37:05.000Z"
  },
  {
    "id": "V-043",
    "name": "Lorry NB-043",
    "status": "idle",
    "lat": 53.4494,
    "lng": -2.18107,
    "lastUpdate": "2026-10-23T04:21:43.000Z"
  },
  {
    "id": "V-044",
    "name": "Truck NB-044",
    "status": "active",
    "lat": 53.41283,
    "lng": -2.22047,
    "lastUpdate": "2026-10-22T14:34:03.000Z"
  },
  {
    "id": "V-045",
    "name": "Lorry NB-045",
    "status": "offline",
    "lat": 53.46994,
    "lng": -2.2085,
    "lastUpdate": "2026-10-23T04:30:59.000Z"
  },
  {
    "id": "V-046",
    "name": "Truck NB-046",
    "status": "active",
    "lat": 53.40715,
    "lng": -2.2918,
    "lastUpdate": "2026-10-22T21:24:59.000Z"
  },
  {
    "id": "V-047",
    "name": "Pickup NB-047",
    "status": "idle",
    "lat": 53.51904,
    "lng": -2.19304,
    "lastUpdate": "2026-10-23T03:17:53.000Z"
  },
  {
    "id": "V-048",
    "name": "Pickup NB-048",
    "status": "active",
    "lat": 53.46653,
    "lng": -2.25619,
    "lastUpdate": "2026-10-22T20:58:58.000Z"
  },
  {
    "id": "V-049",
    "name": "Truck NB-049",
    "status": "active",
    "lat": 53.44614,
    "lng": -2.32047,
    "lastUpdate": "2026-10-22T19:53:23.000Z"
  },
  {
    "id": "V-050",
    "name": "Truck NB-050",
    "status": "active",
    "lat": 53.48219,
    "lng": -2.22053,
    "lastUpdate": "2026-10-22T21:30:27.000Z"
  },
  {
    "id": "V-051",
    "name": "Van NB-051",
    "status": "active",
    "lat": 53.42223,
    "lng": -2.16135,
    "lastUpdate": "2026-10-23T06:20:13.000Z"
  },
  {
    "id": "V-052",
    "name": "Lorry NB-052",
    "status": "active",
    "lat": 53.47537,
    "lng": -2.33024,
    "lastUpdate": "2026-10-22T12:16:48.000Z"
  },
  {
    "id": "V-053",
    "name": "Van NB-053",
    "status": "active",
    "lat": 53.43446,
    "lng": -2.20945,
    "lastUpdate": "2026-10-22T18:27:47.000Z"
  },
  {
    "id": "V-054",
    "name": "Van NB-054",
    "status": "offline",
    "lat": 53.51252,
    "lng": -2.21776,
    "lastUpdate": "2026-10-22T12:53:13.000Z"
  },
  {
    "id": "V-055",
    "name": "Pickup NB-055",
    "status": "maintenance",
    "lat": 53.47906,
    "lng": -2.31463,
    "lastUpdate": "2026-10-23T06:07:34.000Z"
  },
  {
    "id": "V-056",
    "name": "Van NB-056",
    "status": "active",
    "lat": 53.43942,
    "lng": -2.21557,
    "lastUpdate": "2026-10-22T15:57:34.000Z"
  },
  {
    "id": "V-057",
    "name": "Pickup NB-057",
    "status": "offline",
    "lat": 53.40332,
    "lng": -2.27065,
    "lastUpdate": "2026-10-22T23:53:31.000Z"
  },
  {
    "id": "V-058",
    "name": "Truck NB-058",
    "status": "maintenance",
    "lat": 53.4805,
    "lng": -2.30901,
    "lastUpdate": "2026-10-22T09:20:13.000Z"
  },
  {
    "id": "V-059",
    "name": "Lorry NB-059",
    "status": "active",
    "lat": 53.47775,
    "lng": -2.178,
    "lastUpdate": "2026-10-22T09:33:07.000Z"
  },
  {
    "id": "V-060",
    "name": "Pickup NB-060",
    "status": "idle",
    "lat": 53.52149,
    "lng": -2.2876,
    "lastUpdate": "2026-10-22T20:08:36.000Z"
  },
  {